# Use case 3 >>>>>>>>

mysql>  INSERT INTO employee_payroll VALUES (100, "Rhushi", 10000, '2022-07-05');
Query OK, 1 row affected (0.31 sec)

mysql> SELECT * FROM employee_payroll;
+-----+--------+--------+------------+
| id  | name   | salary | start      |
+-----+--------+--------+------------+
| 100 | Rhushi |  10000 | 2022-07-05 |
+-----+--------+--------+------------+
1 row in set (0.04 sec)

mysql> INSERT INTO employee_payroll VALUES
    -> (101, "Anup", 35000, '2018-05-31'),
    -> (102, "Raju", 22000, '2016-11-25'),
    -> (103, "Vaibhav", 17000, '2018-05-31'),
    -> (104, "Shital", 27000, '2021-09-22'),
    -> (105, "Mohan", 17000, '2019-05-05');
Query OK, 5 rows affected (0.59 sec)
Records: 5  Duplicates: 0  Warnings: 0

mysql> SELECT * FROM employee_payroll;
+-----+---------+--------+------------+
| id  | name    | salary | start      |
+-----+---------+--------+------------+
| 100 | Rhushi  |  10000 | 2022-07-05 |
| 101 | Anup    |  35000 | 2018-05-31 |
| 102 | Raju    |  22000 | 2016-11-25 |
| 103 | Vaibhav |  17000 | 2018-05-31 |
| 104 | Shital  |  27000 | 2021-09-22 |
| 105 | Mohan   |  17000 | 2019-05-05 |
+-----+---------+--------+------------+
6 rows in set (0.00 sec)

mysql> SELECT * FROM employee_payroll WHERE salary > 15000 AND salary < 30000;
+-----+---------+--------+------------+
| id  | name    | salary | start      |
+-----+---------+--------+------------+
| 102 | Raju    |  22000 | 2016-11-25 |
| 103 | Vaibhav |  17000 | 2018-05-31 |
| 104 | Shital  |  27000 | 2021-09-22 |
| 105 | Mohan   |  17000 | 2019-05-05 |
+-----+---------+--------+------------+
4 rows in set (0.00 sec)

mysql> UPDATE employee_payroll SET salary = 20500 WHERE name = 'Raju';
Query OK, 1 row affected (0.14 sec)
Rows matched: 1  Changed: 1  Warnings: 0

mysql> SELECT * FROM employee_payroll;
+-----+---------+--------+------------+
| id  | name    | salary | start      |
+-----+---------+--------+------------+
| 100 | Rhushi  |  10000 | 2022-07-05 |
| 101 | Anup    |  35000 | 2018-05-31 |
| 102 | Raju    |  20500 | 2016-11-25 |
| 103 | Vaibhav |  17000 | 2018-05-31 |
| 104 | Shital  |  27000 | 2021-09-22 |
| 105 | Mohan   |  17000 | 2019-05-05 |
+-----+---------+--------+------------+
6 rows in set (0.00 sec)

mysql> SELECT DISTINCT start FROM employee_payroll;
+------------+
| start      |
+------------+
| 2022-07-05 |
| 2018-05-31 |
| 2016-11-25 |
| 2021-09-22 |
| 2019-05-05 |
+------------+
5 rows in set (0.04 sec)

mysql> DELETE FROM employee_payroll WHERE salary = 20500;
Query OK, 1 row affected (0.11 sec)

mysql> SELECT * FROM employee_payroll;
+-----+---------+--------+------------+
| id  | name    | salary | start      |
+-----+---------+--------+------------+
| 100 | Rhushi  |  10000 | 2022-07-05 |
| 101 | Anup    |  35000 | 2018-05-31 |
| 103 | Vaibhav |  17000 | 2018-05-31 |
| 104 | Shital  |  27000 | 2021-09-22 |
| 105 | Mohan   |  17000 | 2019-05-05 |
+-----+---------+--------+------------+
5 rows in set (0.00 sec)

mysql> SELECT * FROM employee_payroll WHERE
    -> (id = 104 AND start = '2022-07-05') OR
    -> (name = "Rhushi" AND salary > 30000);
Empty set (0.06 sec)

mysql>